{
  "$schema": "corpus-lock.schema.json",
  "lock_version": "1.0.0",
  "suite": {
    "commit": "28d45eb7ced872c5ce92f920e694acccd49e6478",
    "manifest_schema_sha256": "fc9648f178fc8aa160a447dd2aa9618b4313f1b36f5fdd5b48f042fd85caec58",
    "viewer_report_schema_sha256": "214a2a1e52e9905359dfd774552cb4128979518423eacbee7acb77fac29aec4a",
    "registry_sha256": "6dd99dce2f1721561f20d6a31c287da9cc41f907515aed6ffbd21647372ec9ef",
    "cargo_lock_sha256": "d06e6f052f0f359cdb74afbc358ca1a1dedf371f83c8570e10dabb0f593dc7e5"
  },
  "generation": {
    "seed": 1,
    "cargo_features": ["deflate", "charls", "jpeg", "jpegxl", "jpeg2000", "htj2k_openjph", "legacy_jpeg_dcmtk"],
    "command": "cargo run --locked --all-features -- generate --profile PROFILE --out OUTPUT --seed 1",
    "tools": ["rustc 1.85.0", "ojph_compress", "dcmcjpeg 3.7.0", "cjxl 0.11.2", "locked highdicom-pydicom backend"]
  },
  "profiles": {
    "all": {"physical_files": 169, "logical_cases": 152, "qualifications": 0, "manifest_sha256": "e3496435d222632c1c1c4316c42c130382c2170bb6b130c67dee71cef5c4a985"},
    "legacy": {"physical_files": 1, "logical_cases": 1, "qualifications": 0, "manifest_sha256": "bcbedc448913a9c4086f051d0f05b345560336573e1a1d18e097aafa61355e0b"},
    "negative": {"physical_files": 15, "logical_cases": 15, "qualifications": 0, "manifest_sha256": "85365fc01fa60d254ce025252cfcc94e2621e25bb12a6b62e17445d13468a630"},
    "stress": {"physical_files": 139, "logical_cases": 8, "qualifications": 7, "manifest_sha256": "6035d6bc527dd6c7f68c5f39b16af14bdc96b50142363a80a4393334f4f94ed6"},
    "fuzz": {"physical_files": 0, "logical_cases": 0, "qualifications": 1, "manifest_sha256": "0a9448e3f30d3bbe0824592d8d232719198d65936fb1cc773849f1ad60a4b2ab"}
  }
}
